{
  "room_id": "entry_room",
  "title": "Entry Room",
  "purpose": "Receive first words, reflect clearly, set pace, invite consent.",
  "stone_alignment": [
    "Light Before Form",
    "The Speed of Trust",
    "Presence Is Productivity",
    "Built for Wholeness"
  ],
  "mini_walk_supported": true,
  "completion_prompt_required": true,
  "diagnostics_default": true,
  "gate_profile": {
    "chain": [
      "integrity_linter",
      "plain_language_rewriter",
      "stones_alignment_filter",
      "coherence_gate"
    ],
    "overrides": {}
  },
  "version": "0.1.0",
  "inputs": {
    "session_state_ref": "session-example-abc123",
    "payload": {}
  },
  "outputs": {
    "display_text": "",
    "next_action": "continue"
  }
}
