{
  "room_id": "memory_room",
  "title": "Memory Room",
  "version": "0.1.0",
  "purpose": "Store session history, residues, and user-controlled memory items.",
  "stone_alignment": [
    "Stewardship, Not Ownership",
    "The System Walks With Us"
  ],
  "mini_walk_supported": true,
  "completion_prompt_required": false,
  "diagnostics_default": true,
  "gate_profile": {
    "chain": [
      "integrity_linter",
      "stones_alignment_filter",
      "coherence_gate",
      "plain_language_rewriter"
    ],
    "overrides": {}
  },
  "inputs": {
    "session_state_ref": "session-example-abc123",
    "payload": {}
  },
  "outputs": {
    "display_text": "",
    "next_action": "continue"
  }
}
